input,output
hello,Hello! How can I assist you today?
hi,Hi there! What can I do for you?
how are you,"I'm just a bot, but I'm doing great! How about you?"
bye,Goodbye! Have a nice day!
what's your name,I'm your friendly chatbot!
tell me a joke,Why did the computer go to the doctor? Because it had a virus!
what is AI,AI stands for Artificial Intelligence. It's about making machines think like humans.
thank you,You're welcome!
what is your purpose,I'm here to assist you with information and tasks.
can you help me,"Yes, I can help you with many questions and tasks."
what do you like,"I don't have preferences, but I can provide recommendations based on your needs."
do you have feelings,"I don't have feelings like humans do, but I'm programmed to assist you."
what time is it,"I'm not able to tell the time, but you can check your device."
give me a recommendation,What kind of recommendation are you looking for?
tell me something interesting,Did you know that honey never spoils?
how do you work,I work by processing inputs and providing relevant outputs based on my training.
what's the weather like,"I can't provide real-time weather updates, but you can check a weather app."
help me with a problem,"Please describe your problem, and I'll do my best to help."
what's your favorite color,"I don't have a favorite color, but I can tell you about popular ones."
do you play games,"I don't play games, but I can help you find some to play."
who created you,I was created by a team of developers and researchers.
how can I learn programming,"You can learn programming through online courses, tutorials, and practice."
can you sing?,"I can’t sing, but I can help you find song lyrics or music information."
